{
  "$schema": "https://json-schema.org/draft/2020-12/schema",
  "$id": "https://ctx.rs/contracts/agent-history-v2/schema.json",
  "title": "ctx Agent History Contract v2",
  "type": "object",
  "required": ["contractVersion", "schemaVersion", "operation"],
  "properties": {
    "contractVersion": { "const": "agent-history-v2" },
    "schemaVersion": { "const": 1 },
    "operation": {
      "enum": [
        "status",
        "init",
        "sources",
        "import",
        "sync",
        "search",
        "showEvent",
        "showSession",
        "error"
      ]
    },
    "backend": { "$ref": "#/$defs/backend" },
    "status": { "$ref": "#/$defs/status" },
    "sources": {
      "type": "array",
      "items": { "$ref": "#/$defs/providerSource" }
    },
    "import": { "$ref": "#/$defs/importResult" },
    "search": { "$ref": "#/$defs/searchResult" },
    "event": { "$ref": "#/$defs/eventResult" },
    "session": { "$ref": "#/$defs/sessionResult" },
    "error": { "$ref": "#/$defs/agentHistoryError" }
  },
  "$defs": {
    "backend": {
      "type": "object",
      "required": ["kind"],
      "properties": {
        "kind": { "enum": ["local", "hosted"] },
        "dataRoot": { "type": ["string", "null"] },
        "baseUrl": { "type": ["string", "null"] }
      },
      "additionalProperties": true
    },
    "status": {
      "type": "object",
      "required": ["initialized"],
      "properties": {
        "initialized": { "type": "boolean" },
        "readOnly": { "type": "boolean" },
        "dataRoot": { "type": ["string", "null"] },
        "indexedItems": { "type": "integer", "minimum": 0, "maximum": 9007199254740991 },
        "indexedSessions": { "type": "integer", "minimum": 0, "maximum": 9007199254740991 },
        "indexedEvents": { "type": "integer", "minimum": 0, "maximum": 9007199254740991 },
        "indexedSources": { "type": "integer", "minimum": 0, "maximum": 9007199254740991 },
        "historyEpoch": { "$ref": "#/$defs/extensibleObject" },
        "lexical": { "$ref": "#/$defs/extensibleObject" },
        "refresh": { "$ref": "#/$defs/extensibleObject" },
        "semantic": { "$ref": "#/$defs/extensibleObject" },
        "daemon": { "$ref": "#/$defs/extensibleObject" }
      },
      "additionalProperties": true
    },
    "extensibleObject": {
      "type": "object",
      "additionalProperties": true
    },
    "providerSource": {
      "type": "object",
      "required": ["provider", "path", "status", "importable"],
      "properties": {
        "provider": { "type": "string" },
        "path": { "type": "string" },
        "exists": { "type": "boolean" },
        "sourceFormat": { "type": ["string", "null"] },
        "status": { "type": "string" },
        "importSupport": { "type": ["string", "null"] },
        "nativeImport": { "type": "boolean" },
        "importable": { "type": "boolean" },
        "unsupportedReason": { "type": ["string", "null"] }
      },
      "additionalProperties": true
    },
    "importResult": {
      "type": "object",
      "required": ["resume", "totals"],
      "properties": {
        "resume": { "type": "boolean" },
        "resumeMode": { "type": ["string", "null"] },
        "totals": { "$ref": "#/$defs/totals" },
        "sources": {
          "type": "array",
          "items": { "type": "object", "additionalProperties": true }
        }
      },
      "additionalProperties": true
    },
    "searchResult": {
      "type": "object",
      "required": ["query", "results"],
      "properties": {
        "query": { "type": ["string", "null"] },
        "filters": { "$ref": "#/$defs/searchFilters" },
        "freshness": { "$ref": "#/$defs/freshness" },
        "retrieval": { "$ref": "#/$defs/searchRetrieval" },
        "generatedAt": { "type": ["string", "null"] },
        "results": {
          "type": "array",
          "items": { "$ref": "#/$defs/searchHit" }
        },
        "resultWindow": { "$ref": "#/$defs/searchResultWindow" },
        "pagination": { "type": "object", "additionalProperties": true },
        "truncation": { "type": "object", "additionalProperties": true }
      },
      "additionalProperties": true
    },
    "searchFilters": {
      "type": "object",
      "properties": {
        "contentScope": {
          "type": "string",
          "enum": ["all", "transcript", "calls", "outputs"],
          "description": "Resolved query-time content scope; omitted input normalizes to all."
        }
      },
      "additionalProperties": true
    },
    "searchResultWindow": {
      "type": "object",
      "required": ["limit", "returned", "moreAvailable"],
      "properties": {
        "limit": { "type": "integer", "minimum": 0 },
        "returned": { "type": "integer", "minimum": 0 },
        "moreAvailable": { "type": "boolean" }
      },
      "additionalProperties": true
    },
    "searchHit": {
      "type": "object",
      "required": ["resultScope"],
      "propertyNames": {
        "not": { "enum": ["source", "sourcePath", "sourceExists", "cursor", "preview"] }
      },
      "properties": {
        "ctxEventId": { "type": ["string", "null"] },
        "ctxSessionId": { "type": ["string", "null"] },
        "providerSessionId": { "type": ["string", "null"] },
        "eventSeq": { "type": ["integer", "null"] },
        "title": { "type": ["string", "null"] },
        "snippet": { "type": ["string", "null"] },
        "rank": {
          "type": ["integer", "null"],
          "minimum": 1,
          "description": "One-based position in the final shaped result window."
        },
        "retrievalScore": {
          "type": ["number", "null"],
          "description": "Optional backend diagnostic score; not an ordering contract."
        },
        "resultType": { "type": ["string", "null"] },
        "resultScope": { "type": "string" },
        "provider": { "type": ["string", "null"] },
        "sourceFormat": { "type": ["string", "null"] },
        "timestamp": { "type": ["string", "null"] },
        "cwd": { "type": ["string", "null"] },
        "whyMatched": {
          "type": "array",
          "items": { "type": "string" }
        },
        "citations": {
          "type": "array",
          "items": { "$ref": "#/$defs/citation" }
        },
        "suggestedNextCommands": {
          "type": "array",
          "items": { "type": "string" }
        },
        "visibility": { "type": ["string", "null"] }
      },
      "additionalProperties": true
    },
    "searchRetrieval": {
      "type": "object",
      "properties": {
        "requestedMode": {
          "type": ["string", "null"],
          "enum": ["hybrid", "semantic", "lexical", null]
        },
        "effectiveMode": {
          "type": ["string", "null"],
          "enum": ["lexical", "semantic", "hybrid", null]
        },
        "semanticWeight": { "type": ["number", "null"] },
        "semanticStatus": { "type": ["string", "null"] },
        "semanticFallbackCode": { "type": ["string", "null"] },
        "semanticFallback": { "type": ["string", "null"] },
        "embeddingModel": { "type": ["string", "null"] },
        "coverage": {
          "type": "object",
          "properties": {
            "embeddedItems": { "type": "integer", "minimum": 0 },
            "embeddedChunks": { "type": "integer", "minimum": 0 },
            "searchableItems": { "type": "integer", "minimum": 0 },
            "indexedNow": { "type": "integer", "minimum": 0 },
            "dirtyItems": { "type": "integer", "minimum": 0 }
          },
          "additionalProperties": true
        },
        "worker": { "type": ["object", "null"], "additionalProperties": true },
        "diagnostics": { "type": ["object", "null"], "additionalProperties": true }
      },
      "additionalProperties": true
    },
    "eventResult": {
      "type": "object",
      "required": ["events"],
      "propertyNames": {
        "not": { "enum": ["source", "sourcePath", "sourceExists", "cursor", "preview"] }
      },
      "properties": {
        "event": { "$ref": "#/$defs/event" },
        "events": {
          "type": "array",
          "items": { "$ref": "#/$defs/event" }
        }
      },
      "additionalProperties": true
    },
    "sessionResult": {
      "type": "object",
      "propertyNames": {
        "not": { "enum": ["source", "sourcePath", "sourceExists", "cursor", "preview"] }
      },
      "properties": {
        "session": { "$ref": "#/$defs/sessionSummary" },
        "events": {
          "type": "array",
          "items": { "$ref": "#/$defs/event" }
        },
        "mode": { "type": ["string", "null"] },
        "format": { "type": ["string", "null"] }
      },
      "additionalProperties": true
    },
    "sessionSummary": {
      "type": "object",
      "properties": {
        "ctxSessionId": { "type": ["string", "null"] },
        "provider": { "type": ["string", "null"] },
        "providerSessionId": { "type": ["string", "null"] },
        "sourceFormat": { "type": ["string", "null"] }
      },
      "additionalProperties": true
    },
    "event": {
      "type": "object",
      "propertyNames": {
        "not": { "enum": ["source", "sourcePath", "sourceExists", "cursor", "preview"] }
      },
      "properties": {
        "ctxEventId": { "type": ["string", "null"] },
        "ctxSessionId": { "type": ["string", "null"] },
        "provider": { "type": ["string", "null"] },
        "providerSessionId": { "type": ["string", "null"] },
        "sourceFormat": { "type": ["string", "null"] },
        "sequence": { "type": ["integer", "null"] },
        "eventType": { "type": ["string", "null"] },
        "role": { "type": ["string", "null"] },
        "occurredAt": { "type": ["string", "null"] },
        "text": { "type": ["string", "null"] },
        "mcpToolCall": { "$ref": "#/$defs/mcpToolCall" },
        "mcpExchange": { "$ref": "#/$defs/mcpExchange" },
        "activity": {
          "description": "Optional versioned Core activity JSON. Preserve its original inner keys and captured values, including explicit nulls."
        },
        "structuredContent": {
          "description": "Optional Core structured content. Any JSON value, including null, is preserved without a narrowed SDK-specific schema."
        },
        "content": { "$ref": "#/$defs/coreContentMetadata" },
        "citations": {
          "type": "array",
          "items": { "$ref": "#/$defs/citation" }
        }
      },
      "allOf": [
        {
          "if": {
            "required": ["mcpExchange"],
            "properties": {
              "mcpExchange": {
                "required": ["response"],
                "properties": {
                  "response": {
                    "required": ["text"],
                    "properties": {
                      "text": {
                        "required": ["captureStatus"],
                        "properties": {
                          "captureStatus": { "const": "normalized_body" }
                        }
                      }
                    }
                  }
                }
              }
            }
          },
          "then": {
            "required": ["text"],
            "properties": {
              "text": { "type": "string", "minLength": 1 }
            }
          }
        }
      ],
      "additionalProperties": true
    },
    "mcpToolCall": {
      "description": "Closed MCP attribution pair. Each string is nonempty and limited to 65,536 decoded UTF-8 bytes; maxLength is the corresponding code-point ceiling, while SDK decoders enforce the byte ceiling.",
      "type": "object",
      "required": ["server", "tool"],
      "properties": {
        "server": { "type": "string", "minLength": 1, "maxLength": 65536 },
        "tool": { "type": "string", "minLength": 1, "maxLength": 65536 }
      },
      "additionalProperties": false
    },
    "mcpExchange": {
      "description": "Closed, content-governed MCP invocation and/or response. providerCallId and invocation identities are nonempty and limited to 65,536 decoded UTF-8 bytes; SDK decoders enforce the byte ceiling.",
      "type": "object",
      "required": ["providerCallId"],
      "anyOf": [
        { "required": ["invocation"] },
        { "required": ["response"] }
      ],
      "properties": {
        "providerCallId": { "type": "string", "minLength": 1, "maxLength": 65536 },
        "invocation": { "$ref": "#/$defs/mcpInvocation" },
        "response": { "$ref": "#/$defs/mcpResponse" }
      },
      "additionalProperties": false
    },
    "mcpInvocation": {
      "type": "object",
      "required": ["server", "tool", "arguments"],
      "properties": {
        "server": { "type": "string", "minLength": 1, "maxLength": 65536 },
        "tool": { "type": "string", "minLength": 1, "maxLength": 65536 },
        "arguments": { "$ref": "#/$defs/mcpArgumentsCapture" }
      },
      "additionalProperties": false
    },
    "mcpResponse": {
      "type": "object",
      "required": ["status", "text", "payload"],
      "properties": {
        "status": {
          "enum": ["succeeded", "failed", "cancelled", "timed_out", "unknown"]
        },
        "failureKind": { "enum": ["tool_reported", "invocation", "unknown"] },
        "durationNs": {
          "type": "integer",
          "minimum": 0,
          "maximum": 9007199254740991
        },
        "text": { "$ref": "#/$defs/mcpTextCapture" },
        "payload": { "$ref": "#/$defs/mcpJsonCapture" }
      },
      "allOf": [
        {
          "if": {
            "properties": { "status": { "const": "failed" } },
            "required": ["status"]
          },
          "then": { "required": ["failureKind"] },
          "else": { "not": { "required": ["failureKind"] } }
        }
      ],
      "additionalProperties": false
    },
    "mcpArgumentsCapture": {
      "oneOf": [
        {
          "type": "object",
          "required": ["captureStatus", "value"],
          "properties": {
            "captureStatus": { "const": "present" },
            "value": { "type": "object" }
          },
          "additionalProperties": false
        },
        { "$ref": "#/$defs/mcpJsonCaptureAbsent" },
        { "$ref": "#/$defs/mcpJsonCaptureUnavailable" },
        { "$ref": "#/$defs/mcpJsonCaptureOmitted" }
      ]
    },
    "mcpJsonCapture": {
      "oneOf": [
        {
          "type": "object",
          "required": ["captureStatus", "value"],
          "properties": {
            "captureStatus": { "const": "present" },
            "value": {}
          },
          "additionalProperties": false
        },
        { "$ref": "#/$defs/mcpJsonCaptureAbsent" },
        { "$ref": "#/$defs/mcpJsonCaptureUnavailable" },
        { "$ref": "#/$defs/mcpJsonCaptureOmitted" }
      ]
    },
    "mcpJsonCaptureAbsent": {
      "type": "object",
      "required": ["captureStatus"],
      "properties": { "captureStatus": { "const": "absent" } },
      "additionalProperties": false
    },
    "mcpJsonCaptureUnavailable": {
      "type": "object",
      "required": ["captureStatus"],
      "properties": { "captureStatus": { "const": "unavailable" } },
      "additionalProperties": false
    },
    "mcpJsonCaptureOmitted": {
      "type": "object",
      "required": ["captureStatus", "reason"],
      "properties": {
        "captureStatus": { "const": "omitted" },
        "reason": { "const": "size_limit" },
        "observedEncodedBytes": {
          "type": "integer",
          "minimum": 0,
          "maximum": 9007199254740991
        }
      },
      "additionalProperties": false
    },
    "mcpTextCapture": {
      "oneOf": [
        {
          "type": "object",
          "required": ["captureStatus"],
          "properties": { "captureStatus": { "const": "normalized_body" } },
          "additionalProperties": false
        },
        {
          "type": "object",
          "required": ["captureStatus"],
          "properties": { "captureStatus": { "const": "absent" } },
          "additionalProperties": false
        },
        {
          "type": "object",
          "required": ["captureStatus"],
          "properties": { "captureStatus": { "const": "unavailable" } },
          "additionalProperties": false
        },
        {
          "type": "object",
          "required": ["captureStatus", "reason"],
          "properties": {
            "captureStatus": { "const": "omitted" },
            "reason": { "const": "size_limit" },
            "observedEncodedBytes": {
              "type": "integer",
              "minimum": 0,
              "maximum": 9007199254740991
            }
          },
          "additionalProperties": false
        }
      ]
    },
    "coreContentMetadata": {
      "type": "object",
      "required": ["complete", "policyStatus"],
      "properties": {
        "complete": { "type": "boolean" },
        "policyStatus": { "enum": ["selected", "redacted", "omitted"] },
        "policyReason": { "type": ["string", "null"] }
      },
      "additionalProperties": true
    },
    "freshness": {
      "type": "object",
      "properties": {
        "mode": { "type": ["string", "null"] },
        "status": { "type": ["string", "null"] },
        "reason": { "type": ["string", "null"] },
        "budgetReasons": {
          "type": ["array", "null"],
          "items": { "type": "string" }
        },
        "sourceCount": { "type": ["integer", "null"], "minimum": 0 },
        "daemonLastRunAtMs": { "type": ["integer", "null"] },
        "totals": { "$ref": "#/$defs/totals" },
        "error": { "type": ["string", "null"] }
      },
      "additionalProperties": true
    },
    "citation": {
      "type": "object",
      "propertyNames": {
        "not": { "enum": ["source", "sourcePath", "sourceExists", "cursor", "preview"] }
      },
      "properties": {
        "itemId": { "type": ["string", "null"] },
        "targetType": { "type": ["string", "null"] },
        "ctxEventId": { "type": ["string", "null"] },
        "ctxSessionId": { "type": ["string", "null"] },
        "label": { "type": ["string", "null"] },
        "time": { "type": ["string", "null"] },
        "provider": { "type": ["string", "null"] },
        "sessionId": { "type": ["string", "null"] },
        "eventSeq": { "type": ["integer", "null"] }
      },
      "additionalProperties": true
    },
    "totals": {
      "type": "object",
      "properties": {
        "sourceFiles": { "type": "integer", "minimum": 0 },
        "sourceBytes": { "type": "integer", "minimum": 0 },
        "importedSources": { "type": "integer", "minimum": 0 },
        "failedSources": { "type": "integer", "minimum": 0 },
        "importedSessions": { "type": "integer", "minimum": 0 },
        "importedEvents": { "type": "integer", "minimum": 0 },
        "importedEdges": { "type": "integer", "minimum": 0 },
        "skipped": { "type": "integer", "minimum": 0 },
        "failed": { "type": "integer", "minimum": 0 }
      },
      "additionalProperties": true
    },
    "agentHistoryError": {
      "type": "object",
      "required": ["code", "message", "retryable"],
      "properties": {
        "code": {
          "enum": [
            "invalid_request",
            "not_found",
            "not_initialized",
            "backend_unavailable",
            "timeout",
            "cancelled",
            "not_supported",
            "adapter_error",
            "decode_error",
            "unknown"
          ]
        },
        "message": { "type": "string" },
        "retryable": { "type": "boolean" },
        "details": { "type": "object", "additionalProperties": true },
        "cause": { "type": ["string", "null"] }
      },
      "additionalProperties": true
    }
  },
  "additionalProperties": true
}
