{
  "contractVersion": "agent-history-v2",
  "schemaVersion": 1,
  "operation": "showEvent",
  "backend": {
    "kind": "local",
    "dataRoot": "/tmp/ctx-sdk-fixture"
  },
  "event": {
    "event": {
      "ctxEventId": "11111111-1111-4111-8111-111111111111",
      "ctxSessionId": "22222222-2222-4222-8222-222222222222",
      "provider": "codex",
      "providerSessionId": "codex-fixture-session",
      "sourceFormat": "codex_session_jsonl",
      "sequence": 1,
      "eventType": "message",
      "role": "assistant",
      "occurredAt": "2026-07-01T12:00:00Z",
      "text": "local agent history search result",
      "structuredContent": {
        "kind": "toolResult",
        "payload": {
          "ok": true,
          "count": 2,
          "items": ["alpha", null, {"nested": [1, false]}]
        }
      },
      "content": {
        "complete": true,
        "policyStatus": "selected"
      }
    },
    "events": [
      {
        "ctxEventId": "11111111-1111-4111-8111-111111111111",
        "ctxSessionId": "22222222-2222-4222-8222-222222222222",
        "provider": "codex",
        "providerSessionId": "codex-fixture-session",
        "sourceFormat": "codex_session_jsonl",
        "sequence": 1,
        "eventType": "message",
        "role": "assistant",
        "occurredAt": "2026-07-01T12:00:00Z",
        "text": "local agent history search result",
        "structuredContent": null,
        "content": {
          "complete": true,
          "policyStatus": "selected"
        }
      }
    ]
  }
}
