{
  "contractVersion": "agent-history-v2",
  "schemaVersion": 1,
  "operation": "showSession",
  "backend": {
    "kind": "local",
    "dataRoot": "/tmp/ctx-sdk-fixture"
  },
  "session": {
    "session": {
      "ctxSessionId": "22222222-2222-4222-8222-222222222222",
      "provider": "codex",
      "providerSessionId": "codex-fixture-session",
      "sourceFormat": "codex_session_jsonl",
      "title": "Fixture session"
    },
    "events": [
      {
        "ctxEventId": "11111111-1111-4111-8111-111111111111",
        "ctxSessionId": "22222222-2222-4222-8222-222222222222",
        "provider": "codex",
        "providerSessionId": "codex-fixture-session",
        "sourceFormat": "codex_session_jsonl",
        "sequence": 1,
        "eventType": "message",
        "role": "assistant",
        "text": "local agent history search result",
        "structuredContent": ["transcript", {"complete": true}, null],
        "content": {
          "complete": true,
          "policyStatus": "selected"
        }
      }
    ],
    "mode": "lite",
    "format": "json"
  }
}
