{
  "contractVersion": "agent-history-v2",
  "schemaVersion": 1,
  "operation": "search",
  "backend": {
    "kind": "local",
    "dataRoot": "/tmp/ctx-sdk-fixture"
  },
  "search": {
    "query": "local agent history",
    "filters": {
      "provider": "codex",
      "contentScope": "all"
    },
    "freshness": {
      "mode": "off",
      "status": "skipped",
      "sourceCount": 0,
      "totals": {
        "importedEvents": 0
      },
      "error": null
    },
    "generatedAt": "2026-07-01T12:00:00Z",
    "retrieval": {
      "requestedMode": "hybrid",
      "effectiveMode": "hybrid",
      "semanticWeight": 0.35,
      "semanticStatus": "ready",
      "semanticFallbackCode": null,
      "semanticFallback": null,
      "embeddingModel": "sentence-transformers/all-MiniLM-L6-v2",
      "coverage": {
        "embeddedItems": 1200,
        "embeddedChunks": 1500,
        "searchableItems": 1200,
        "indexedNow": 0,
        "dirtyItems": 0
      },
      "diagnostics": {
        "queryEmbedMs": 2,
        "vectorScanMs": 1,
        "chunksScanned": 200
      }
    },
    "results": [
      {
        "ctxEventId": "11111111-1111-4111-8111-111111111111",
        "ctxSessionId": "22222222-2222-4222-8222-222222222222",
        "providerSessionId": "codex-fixture-session",
        "eventSeq": 1,
        "title": "Fixture session",
        "snippet": "local agent history search result",
        "rank": 1,
        "retrievalScore": 0.98,
        "resultType": "event",
        "resultScope": "event",
        "provider": "codex",
        "sourceFormat": "codex_session_jsonl",
        "timestamp": "2026-07-01T12:00:00Z",
        "cwd": "/workspace/ctx",
        "whyMatched": ["text"],
        "citations": [
          {
            "targetType": "event",
            "ctxEventId": "11111111-1111-4111-8111-111111111111",
            "ctxSessionId": "22222222-2222-4222-8222-222222222222",
            "label": "codex event",
            "provider": "codex"
          }
        ],
        "suggestedNextCommands": [
          "ctx show event 11111111-1111-4111-8111-111111111111 --window 10",
          "ctx search 'local agent history' --session 22222222-2222-4222-8222-222222222222",
          "ctx show session 22222222-2222-4222-8222-222222222222"
        ],
        "visibility": "local_only"
      }
    ],
    "resultWindow": {
      "limit": 20,
      "returned": 1,
      "moreAvailable": false
    },
    "pagination": {
      "limit": 20,
      "hasMore": false
    },
    "truncation": {
      "truncated": false
    }
  }
}
