{
  "contractVersion": "agent-history-v2",
  "schemaVersion": 1,
  "operation": "import",
  "backend": {
    "kind": "local",
    "dataRoot": "/tmp/ctx-sdk-fixture"
  },
  "import": {
    "resume": false,
    "resumeMode": "normal_scan",
    "totals": {
      "sourceFiles": 1,
      "sourceBytes": 2048,
      "importedSources": 1,
      "failedSources": 0,
      "importedSessions": 1,
      "importedEvents": 2,
      "importedEdges": 1,
      "skipped": 0,
      "failed": 0
    },
    "sources": []
  }
}
