{
  "contractVersion": "agent-history-v2",
  "schemaVersion": 1,
  "operation": "search",
  "backend": {
    "kind": "local",
    "dataRoot": "/tmp/ctx-sdk-fixture"
  },
  "search": {
    "query": "no matches",
    "filters": {
      "provider": "codex",
      "contentScope": "all"
    },
    "freshness": {
      "mode": "off",
      "status": "skipped",
      "sourceCount": 0,
      "totals": {},
      "error": null
    },
    "generatedAt": "2026-07-01T12:05:00Z",
    "retrieval": {
      "requestedMode": "hybrid",
      "effectiveMode": "lexical",
      "semanticWeight": 0,
      "semanticStatus": "skipped",
      "semanticFallbackCode": null,
      "semanticFallback": null,
      "coverage": {
        "embeddedItems": 0,
        "embeddedChunks": 0,
        "searchableItems": 0,
        "indexedNow": 0,
        "dirtyItems": 0
      }
    },
    "results": [],
    "resultWindow": {
      "limit": 20,
      "returned": 0,
      "moreAvailable": false
    },
    "pagination": {
      "limit": 20,
      "hasMore": false
    },
    "truncation": {
      "truncated": false
    }
  }
}
